,Date,name,tweet,death,Classification
120,2020-03-23,"Eric ""Wear Your Mask"" Olson", test data shows that the best choices for diy masks are cotton tshirts pillowcases or other cotton materials   covid19 coronavirus,63818,neg
121,2020-03-23,Change.org, well over 400000 people and counting agree with this do you covid19 coronavirus emergencymoney    ,63818,neg
122,2020-03-23,Matthew Chayes, a study predicted that unless aggressive action is taken the coronavirus could kill 22 million americans in the coming months a day after that study was published its lead researcher developed a dry cough and fever he had covid19  ,63818,neg
123,2020-03-23,Darren McQuade, nearly deserted brooklynbattery tunnel covid19 stayhome coronavirusnewyork coronavirus covid19 flattenthecurve nyc pix11news  ,63818,neg
124,2020-03-23,Mikey Kay, 2 covid19 that s the second time it gets passed on by the time that s happened 10 times i ve been responsible for about 14 cases of flu this coronavirus is very very contagious,63818,neg
125,2020-03-23,Tina Cervasio, also tonight on fox5ny sportsxtra darryl strawberry talks coronavirus coloncancerawareness don t let covid_19 distract you from other major health issues you could be having straw is a coloncancer survivor diagnosed much younger than doctor recommended colonoscopies  ,63818,pos
