,Date,name,tweet,death
144,2020-04-13,Donald J. Trump, having been involved in the negotiations to put it mildly the number that opec is looking to cut is 20 million barrels a day not the 10 million that is generally being reported if anything near this happens and the world gets back to business from the covid 19,65853
145,2020-04-13,Donald J. Trump, the nytimes story is a fake just like the paper itself i was criticized for moving too fast when i issued the china ban long before most others wanted to do so secazar told me nothing until later and peter navarro memo was same as ban see his statements fake news,65853
146,2020-04-13,Donald J. Trump, i am working hard to expose the corruption and dishonesty in the lamestream media that part is easy the hard part is why,65853
147,2020-04-13,Donald J. Trump, thank you paris  ,65853
148,2020-04-13,Donald J. Trump, thank you  ,65853
149,2020-04-13,Donald J. Trump, i look forward to it also  ,65853
150,2020-04-13,Donald J. Trump, great going natalie  ,65853
151,2020-04-13,Donald J. Trump, sorry fake news it s all on tape i banned china long before people spoke up thank you oann  ,65853
152,2020-04-13,Donald J. Trump, fake news  ,65853
153,2020-04-13,Donald J. Trump, governors get your states testing programs apparatus perfected be ready big things are happening no excuses the federal government is there to help we are testing more than any country in the world also gear up with face masks,65853
154,2020-04-13,Donald J. Trump, the opposition party lamestream media and their partner the radical left do nothing democrats have put their political game plan in full swing whether he is right or wrong it doesn t matter criticize trump for everything and don t let the public see biden hide him,65853
155,2020-04-12,Donald J. Trump, if the fake news opposition party is pushing with all their might the fact that president trump ignored early warnings about the threat then why did media dems viciously criticize me when i instituted a travel ban on china they said early not necessary corrupt media,65853
156,2020-04-12,Donald J. Trump, just watched mike wallace wannabe chris wallace on foxnews i am now convinced that he is even worse than sleepy eyes chuck todd of meet the press please or the people over at deface the nation what the hell is happening to foxnews it s a whole new ballgame over there,65853
157,2020-04-12,Donald J. Trump, the big oil deal with opec plus is done this will save hundreds of thousands of energy jobs in the united states i would like to thank and congratulate president putin of russia and king salman of saudi arabia i just spoke to them from the oval office great deal for all,65853
158,2020-04-12,Donald J. Trump, for the first time in history there is a fully signed presidential disaster declaration for all 50 states we are winning and will win the war on the invisible enemy,65853
159,2020-04-12,Donald J. Trump,  ,65853
160,2020-04-12,Donald J. Trump,  ,65853
161,2020-04-12,Donald J. Trump,  ,65853
162,2020-04-12,Donald J. Trump, great businessman philanthropist bernie marcus cofounder of home depot said that congress was too distracted by the phony impeachment witch hunt when they should have been investigating coronavirus when it first appeared in china media played a big roll also dcexaminer,65853
163,2020-04-12,Donald J. Trump, happy easter,65853
164,2020-04-12,Donald J. Trump, a very good sign is that empty hospital beds are becoming more and more prevalent we deployed 418 doctors nurses and respiratory therapists from the hospital ship comfort and the javits convention center to hospitals in nyc state have more bed capacity than was needed good,65853
165,2020-04-12,Donald J. Trump, happy easter  ,65853
166,2020-04-12,Donald J. Trump,  ,65853
167,2020-04-12,Donald J. Trump, cryin chuck doesn t have a clue couldn t care less about the american worker  ,65853
168,2020-04-12,Donald J. Trump, mail in ballots substantially increases the risk of crime and voter fraud,65853
169,2020-04-12,Donald J. Trump, will be interviewed by judgejeanine tonight at 900 pm eastern on foxnews  ,65853
170,2020-04-12,Donald J. Trump, so now the fake news nytimes is tracing the coronavirus origins back to europe not china this is a first i wonder what the failing new york times got for this one are there any named sources they were recently thrown out of china like dogs and obviously want back in sad,65853
171,2020-04-12,Donald J. Trump, governor gavinnewsom of california has been very nice highly supportive about the great job we have done working together for california that is the good news but this is the bad he is unfairly under attack by the radical left dems msdnc etc he is strong will he fold,65853
172,2020-04-12,Donald J. Trump, i will be watching have a great easter  ,65853
173,2020-04-12,Donald J. Trump, the wall street journal editorial board doesn t have a clue on how to fight and win their views on tariffs trade are losers for the us but winners for other countries including china if we followed their standards we d have no country left they should love sleepy joe,65853
174,2020-04-12,Donald J. Trump, watching foxnews on weekend afternoons is a total waste of time we now have some great alternatives like oann,65853
175,2020-04-12,Donald J. Trump, the president and the federal government are doing an excellent job when they say the death toll isn t going to be as high as reported they the opposition act like they re sad because it s lower i think they are press conferences wonderful west virginia resident c span,65853
176,2020-04-12,Donald J. Trump, great editorial by senronjohnson  ,65853
177,2020-04-12,Donald J. Trump, wishing all a safe and blessed easter sunday i will be tuning into pastor robertjeffress at http   church in dallas texas tomorrow morning at 1020 am eastern  ,65853
178,2020-04-11,Donald J. Trump, we will build it again,65853
179,2020-04-11,Donald J. Trump, does anyone ever notice how few quotes from an actual person are given nowadays by the lamestream media very seldom the unnamed or anonymous sources are almost always fake news,65853
180,2020-04-11,Donald J. Trump, when the failing nytimes or amazon washingtonpost writes a story saying unnamed sources said or any such phrase where a person s name is not used don t believe them most of these unnamed sources don t exist they are made up to defame disparage they have no source,65853
181,2020-04-11,Donald J. Trump, economy was shuttered this is unprecedented it is unsettling and challenging but we will rise to meet the occasion mack mclarty clinton white house chief of staff lelandvittert foxnews thank you mack we will be bigger better and stronger than ever before,65853
182,2020-04-11,Donald J. Trump, i think the situation is unprecedented and there is no question about that it s whiplash the economy was moving forward at a rapid pace in terms of growth jobs and even wage increases and all of a sudden the pandemic hit and the,65853
183,2020-04-11,Donald J. Trump, trump did a deal with japan a lot of our product goes to japan and we are booming in north dakota jim on c span washington journal our trade deals will be having a big impact on our country as they kick in,65853
184,2020-04-10,Donald J. Trump,  ,65853
185,2020-04-10,Donald J. Trump, nobody wants to say that if elizabeth warren gets out of the race before super tuesday crazy bernie sanders wins virtually every state in a blowout not even close i haven t heard one member of the fake news establishment even mention this irrefutable fact fake news,65853
186,2020-04-10,Donald J. Trump, the invisible enemy will soon be in full retreat,65853
187,2020-04-10,Donald J. Trump, because the tv ratings for the white house news conference s are the highest the opposition party lamestream media the radical left do nothing democrats of course the few remaining rino s are doing everything in their power to disparage end them the people s voice,65853
188,2020-04-10,Donald J. Trump, the white house press conference will take place today at 100 pm recognizing that it is good friday,65853
189,2020-04-10,Donald J. Trump, happy good friday to all,65853
190,2020-04-10,Donald J. Trump, wow approval rating in the republican party 96 thank you,65853
191,2020-04-10,Donald J. Trump, not good gregg but it is what it is have to save the airlines  ,65853
192,2020-04-10,Donald J. Trump, congress must go back to deductibility by businesses if restaurants clubs entertaiment is expected to flourish like never before,65853
193,2020-04-10,Donald J. Trump, democrats are blocking a 251 billion dollar funding boost for small businesses which will help them keep their employees it should be for only that reason with no additions we should have a big infrastructure phase four with payroll tax cuts more big economic bounceback,65853
194,2020-04-10,Donald J. Trump, this week in only 4 days we had the biggest stock market increase since 1974 we have a great chance for the really big bounce when the invisible enemy is gone,65853
195,2020-04-10,Donald J. Trump, tim scott is great  ,65853
196,2020-04-10,Donald J. Trump, thank you frank it s abc fake news they knew they were wrong when they went with this hoax of a story  ,65853
197,2020-04-10,Donald J. Trump, thank you erin  ,65853
198,2020-04-10,Donald J. Trump, we will always be there for our great farmers cattlemen ranchers and producers,65853
199,2020-04-10,Donald J. Trump, i have directed secretarysonny to expedite help to our farmers especially to the smaller farmers who are hurting right now i expect secretary purdue to use all of the funds and authorities at his disposal to make sure that our food supply is stable strong and safe,65853
200,2020-04-09,Donald J. Trump, the wall street journal always forgets to mention that the ratings for the white house press briefings are through the roof monday night football bachelor finale according to nytimes is only way for me to escape the fake news get my views across wsj is fake news,65853
201,2020-04-09,Donald J. Trump, great news prime minister boris johnson has just been moved out of intensive care get well boris,65853
202,2020-04-09,Donald J. Trump, on national former prisoner of war recognition day we honor the more than 500000 american warriors captured while protecting our way of life we pay tribute to these patriots for their unwavering and unrelenting spirit  ,65853
203,2020-04-09,Donald J. Trump, oann a key coronavirus model is now predicting far fewer deaths than the number shown in earlier models that s because the american people are doing a great job social distancing etc keep going,65853
204,2020-04-09,Donald J. Trump, absentee ballots are a great way to vote for the many senior citizens military and others who can t get to the polls on election day these ballots are very different from 100 mailin voting which is ripe for fraud and shouldn t be allowed,65853
205,2020-04-09,Donald J. Trump, this morning 450000 protective suits landed in dallas texas this was made possible because of the partnership of two great american companiesdupont and fedexand our friends in vietnam thank you dupont_news fedex  ,65853
206,2020-04-09,Donald J. Trump,  ,65853
207,2020-04-08,Donald J. Trump, wishing a happy passover to those celebrating in the united states israel and around the world  ,65853
208,2020-04-08,Donald J. Trump, white house news conference at 530 pm eastern thank you,65853
209,2020-04-08,Donald J. Trump, extraordinary times require even closer cooperation between friends thank you india and the indian people for the decision on hcq will not be forgotten thank you prime minister narendramodi for your strong leadership in helping not just india but humanity in this fight,65853
210,2020-04-08,Donald J. Trump, can t see aoc plus 3 supporting sleepy joe,65853
211,2020-04-08,Donald J. Trump, wow bernie is unwilling to give up his delegates and wants more of them what s that all about,65853
212,2020-04-08,Donald J. Trump, bernie sanders is out thank you to elizabeth warren if not for her bernie would have won almost every state on super tuesday this ended just like the democrats the dnc wanted same as the crooked hillary fiasco the bernie people should come to the republican party trade,65853
213,2020-04-08,Donald J. Trump, flattening of the curve,65853
214,2020-04-08,Donald J. Trump, once we open up our great country and it will be sooner rather than later the horror of the invisible enemy except for those that sadly lost a family member or friend must be quickly forgotten our economy will boom perhaps like never before,65853
215,2020-04-08,Donald J. Trump, the fake news media into not covering them but that effort failed because the ratings are through the roof according to of all sources the failing new york times monday night football bachelor finale type numbers sadly they get it free trump derangement syndrome,65853
216,2020-04-08,Donald J. Trump, the radical left democrats have gone absolutely crazy that i am doing daily presidential news conferences they actually want me to stop they used to complain that i am not doing enough of them now they complain that i shouldn t be allowed to do them they tried to shame,65853
217,2020-04-08,Donald J. Trump, will be immediately sending 100 ventilators to colorado at the request of senator gardner  ,65853
218,2020-04-08,Donald J. Trump, republicans should fight very hard when it comes to state wide mailin voting democrats are clamoring for it tremendous potential for voter fraud and for whatever reason doesn t work out well for republicans foxandfriends,65853
219,2020-04-08,Donald J. Trump, the number of new yorkers admitted to hospitals has dropped ainsleyearhardt foxandfriends good news,65853
220,2020-04-08,Donald J. Trump,  ,65853
221,2020-04-08,Donald J. Trump,  ,65853
222,2020-04-08,Donald J. Trump,  ,65853
223,2020-04-08,Donald J. Trump, white house news conference at 530 pm eastern thank you,65853
224,2020-04-07,Donald J. Trump,  ,65853
225,2020-04-07,Donald J. Trump, just had a conf call w major lenders discussing our great small businesses the ppploan i ask every company big small making announcements about innovative contributions hiring new workers or looking to overcome setbacks to share your stories with americaworkstogether  ,65853
226,2020-04-07,Donald J. Trump, wisconsin get out and vote now for justice daniel kelly protect your 2nd amendment,65853
227,2020-04-07,Donald J. Trump, why didn t the ig who spent 8 years with the obama administration did she report on the failed h1n1 swine flu debacle where 17000 people died want to talk to the admirals generals vp others in charge before doing her report another fake dossier,65853
228,2020-04-07,Donald J. Trump, the who really blew it for some reason funded largely by the united states yet very china centric we will be giving that a good look fortunately i rejected their advice on keeping our borders open to china early on why did they give us such a faulty recommendation,65853
229,2020-04-07,Donald J. Trump, vote today tuesday for highly respected republican justice daniel kelly tough on crime loves your military vets farmers will save your 2nd amendment a big vote  ,65853
230,2020-04-07,Donald J. Trump, great job being done by dr nicole saphier on foxnews,65853
231,2020-04-07,Donald J. Trump,  ,65853
232,2020-04-07,Donald J. Trump,  ,65853
233,2020-04-07,Donald J. Trump,  ,65853
234,2020-04-07,Donald J. Trump, the wisconsin supreme court ruled that tomorrow s election will proceed as scheduled vote for justice daniel kelly tomorrow and be safe  ,65853
235,2020-04-07,Donald J. Trump, white house news conference at 545 pm eastern thank you,65853
236,2020-04-07,Donald J. Trump, congratulations to state representative karen whitsett of michigan so glad you are getting better  ,65853
237,2020-04-06,Donald J. Trump,  ,65853
238,2020-04-06,Donald J. Trump, joe biden wanted the date for the democrat national convention moved to a later time period now he wants a virtual convention one where he doesn t have to show up gee i wonder why also what ever happened to that phone call he told the fake news he wanted to make to me,65853
239,2020-04-06,Donald J. Trump, advertising in the failing new york times is way down washington post is not much better i can t say whether this is because they are fake news sources of information to a level that few can understand or the virus is just plain beating them up fake news is bad for america,65853
240,2020-04-06,Donald J. Trump, light at the end of the tunnel,65853
241,2020-04-06,Donald J. Trump, usa strong,65853
242,2020-04-06,Donald J. Trump, thank you gayle i only wish the public could fully understand how corrupt dishonest so much of our lamestream media is my press conferences are vital they are reaching millions of people that are not being told the truth haven t been for years witchhunts fake news  ,65853
243,2020-04-06,Donald J. Trump, for humanitarian reasons the passengers from the two coronavirus stricken cruise ships have been given medical treatment and when appropriate allowed to disembark under strict supervision very carefully done people we re dying no other countries would allow them to dock,65853
244,2020-04-06,Donald J. Trump, gayletrotter to this day the establishment media have not admitted that they were wrong and the president was right foxnews,65853
245,2020-04-06,Donald J. Trump,  ,65853
246,2020-04-06,Donald J. Trump,  ,65853
247,2020-04-06,Donald J. Trump, white house news conference at 645 pm eastern thank you,65853
248,2020-04-05,Donald J. Trump, we are learning much about the invisible enemy it is tough and smart but we are tougher and smarter,65853
249,2020-04-05,Donald J. Trump, thank you gayle  ,65853
250,2020-04-05,Donald J. Trump, i agree  ,65853
251,2020-04-05,Donald J. Trump, a very biased journalist  ,65853
252,2020-04-05,Donald J. Trump, a great wonderful woman  ,65853
253,2020-04-05,Donald J. Trump, corrected fake news  ,65853
254,2020-04-05,Donald J. Trump, he wants to raise taxes all over our country  ,65853
255,2020-04-05,Donald J. Trump, disgraceful  ,65853
256,2020-04-05,Donald J. Trump, palm sunday is the beginning of a holy week for many people of faith and a great day to lift our voices in prayer i will be tuning into pastor greglaurie at harvestorg church in riverside california tomorrow at 1100 am eastern harvestorg,65853
257,2020-04-04,Donald J. Trump, we will get through this together and bats will be swinging before you know it in the meantime take care of mom and dad and know that this will not be forever littleleagueceo,65853
258,2020-04-04,Donald J. Trump, to all of our youth who are missing the start of their littleleague seasons hang in there we will get you back out on the fields and know that you will be playing baseball soon,65853
259,2020-04-04,Donald J. Trump, the paycheck protection program is up and running the program is open to nonprofits as well so banks be sure to sign up our great religious and veteran organizations that need help,65853
260,2020-04-04,Donald J. Trump, america owes our very hard working food supply workers so much as they produce and deliver high quality food for us during this horrible covid19 join me in thanking our farmers ranchers processors distributors and stores johnboozman,65853
261,2020-04-04,Donald J. Trump,  ,65853
262,2020-04-04,Donald J. Trump, i will be holding a news conference at 330 pm at the white house thank you,65853
263,2020-04-04,Donald J. Trump, cnn is fake news they will take a good story and make it as bad as is humanly possible they are a joke,65853
264,2020-04-04,Donald J. Trump, good idea dana  ,65853
265,2020-04-04,Donald J. Trump, great  ,65853
266,2020-04-04,Donald J. Trump, i agree with this watch  ,65853
267,2020-04-04,Donald J. Trump, i will immediately ask congress for more money to support small businesses under the ppploan if the allocated money runs out so far way ahead of schedule bankofamerica community banks are rocking sbagov ustreasury,65853
268,2020-04-04,Donald J. Trump, i fully agree  ,65853
269,2020-04-04,Donald J. Trump, thank you cory  ,65853
270,2020-04-03,Donald J. Trump, great job being done by bankofamerica and many community banks throughout the country small businesses appreciate your work,65853
271,2020-04-03,Donald J. Trump, the paycheck protection program is now available caresact small business guidance loan resources http sbagov  ,65853
272,2020-04-03,Donald J. Trump, thank you deptofdefense usacehq usnationalguard fema and cdcgov http coronavirusgov  ,65853
273,2020-04-03,Donald J. Trump, thank you usnationalguard keep up the great work  ,65853
274,2020-04-03,Donald J. Trump, great news this week regarding the keystone xl pipeline moving forward with fantastic paying construction jobs for hardworking americans promises made promises kept maga,65853
275,2020-04-03,Donald J. Trump, highly respected justice daniel kelly is running for the supreme court in the great state of wisconsin justice kelly has been doing a terrific job upholding the rule of law and defending your 2a tough on crime loves our military and our vets he has my complete endorsement,65853
276,2020-04-03,Donald J. Trump, we hit 3m hard today after seeing what they were doing with their masks p act all the way big surprise to many in government as to what they were doing will have a big price to pay,65853
277,2020-04-03,Donald J. Trump,  ,65853
278,2020-04-03,Donald J. Trump,  ,65853
279,2020-04-02,Donald J. Trump, 30 days to slow the spread  ,65853
280,2020-04-02,Donald J. Trump, could be as high as 15 million barrels good great news for everyone,65853
281,2020-04-02,Donald J. Trump, just spoke to my friend mbs crown prince of saudi arabia who spoke with president putin of russia i expect hope that they will be cutting back approximately 10 million barrels and maybe substantially more which if it happens will be great for the oil gas industry,65853
282,2020-04-02,Donald J. Trump, the states have to get the money to the people who need it mariabartiromo and fast,65853
283,2020-04-02,Donald J. Trump, have been stocked up and ready long before this crisis hit other states are thrilled with the job we have done sending many ventilators today with thousands being built 51 large cargo planes coming in with medical supplies prefer sending directly to hospitals,65853
284,2020-04-02,Donald J. Trump, massive amounts of medical supplies even hospitals and medical centers are being delivered directly to states and hospitals by the federal government some have insatiable appetites are never satisfied politics remember we are a backup for them the complainers should,65853
285,2020-04-02,Donald J. Trump, it wouldn t matter if you got ten times what was needed it would never be good enough unlike other states new york unfortunately got off to a late start you should have pushed harder stop complaining find out where all of these supplies are going cuomo working hard,65853
286,2020-04-02,Donald J. Trump, somebody please explain to cryin chuck schumer that we do have a military man in charge of distributing goods a very talented admiral in fact new york has gotten far more than any other state including hospitals a hospital ship but no matter what always complaining,65853
287,2020-04-01,Donald J. Trump, upon information and belief iran or its proxies are planning a sneak attack on us troops andor assets in iraq if this happens iran will pay a very heavy price indeed,65853
288,2020-04-01,Donald J. Trump, congress must pass the old and very strongly proven deductibility by businesses on restaurants and entertainment this will bring restaurants and everything related back and stronger than ever move quickly they will all be saved,65853
289,2020-04-01,Donald J. Trump,  ,65853
290,2020-04-01,Donald J. Trump,  ,65853
291,2020-04-01,Donald J. Trump, 30 days to slow the spread covid19 http coronavirusgov  ,65853
