,Date,name,tweet,death
152,2020-02-18,Donald J. Trump, judge jackson now has a request for a new trial based on the unambiguous self outed bias of the foreperson of the jury whose also a lawyer by the way madam foreperson you re a lawyer you have a duty an affirmative obligation to reveal to us when we selected you the,5
153,2020-02-18,Donald J. Trump, the united states is open for business,5
154,2020-02-18,Donald J. Trump, i have seen some of the regulations being circulated including those being contemplated by congress and they are ridiculous i want to make it easy to do business with the united states not difficult everyone in my administration is being so instructed with no excuses,5
155,2020-02-18,Donald J. Trump, product and goods to china and other countries that s what trade is all about we don t want to make it impossible to do business with us that will only mean that orders will go to someplace else as an example i want china to buy our jet engines the best in the world,5
156,2020-02-18,Donald J. Trump, the united states can not will not become such a difficult place to deal with in terms of foreign countries buying our product including for the always used national security excuse that our companies will be forced to leave in order to remain competitive we want to sell,5
157,2020-02-18,Donald J. Trump, the crooked dnc is working overtime to take the democrat nomination away from bernie again watch what happens to the super delegates in round two a rigged convention,5
158,2020-02-18,Donald J. Trump, but maybe i still will witch hunt,5
159,2020-02-18,Donald J. Trump, badly tainted and in my opinion should be thrown out even mueller s statement to congress that he did not see me to become the fbi director again has been proven false the whole deal was a total scam if i wasn t president i d be suing everyone all over the place,5
160,2020-02-18,Donald J. Trump, these were mueller prosecutors and the whole mueller investigation was illegally set up based on a phony and now fully discredited fake dossier lying and forging documents to the fisa court and many other things everything having to do with this fraudulent investigation is,5
161,2020-02-18,Donald J. Trump, would order a new trial i m not so sure about judge jackson i don t know judgenap andrew napolitano foxandfriends,5
162,2020-02-18,Donald J. Trump, existence of these tweets in which you were so harshly negative about the president the people who support him don t you think we wanted to know that before we put you on this jury pretty obvious he should get a new trial i think almost any judge in the country,5
163,2020-02-18,Donald J. Trump, judge jackson now has a request for a new trial based on the unambiguous self outed bias of the foreperson of the jury whose also a lawyer by the way madam foreperson your a lawyer you have a duty an affirmative obligation to reveal to us when we selected you the,5
164,2020-02-18,Donald J. Trump, thank you clint  ,5
165,2020-02-18,Donald J. Trump, praying for ryan newman a great and brave nascar driver prayingforryan,5
166,2020-02-18,Donald J. Trump, ever had to rebuild our military which was totally depleted fed rate up taxes and regulations way down if dems won in 2016 the usa would be in big economic depression military trouble right now the best is yet to come keep america great,5
167,2020-02-18,Donald J. Trump, did you hear the latest con job president obama is now trying to take credit for the economic boom taking place under the trump administration he had the weakest recovery since the great depression despite zero fed rate massive quantitative easing now best jobs numbers,5
168,2020-02-17,Donald J. Trump,  ,5
169,2020-02-17,Donald J. Trump, completion of the daytona 500 on fox network now enjoy,5
170,2020-02-17,Donald J. Trump, they tried to impeach the president eight times before this last impeachment trial that we went through in arizona people are tired of their obstruction their investigations and their impeachments they want them to get to work senmcsallyaz foxandfriends thanks martha,5
171,2020-02-17,Donald J. Trump, happy president s day,5
172,2020-02-17,Donald J. Trump, daytona500  ,5
173,2020-02-16,Donald J. Trump, last week the fake news said that a section of our powerful under construction southern border wall fell over trying to make it sound terrible except the reason was that the concrete foundation was just poured soaking wet when big winds kicked in quickly fixed forever,5
174,2020-02-16,Donald J. Trump, getting ready to go to the daytona 500 will be great,5
175,2020-02-16,Donald J. Trump, thank you to jackbrewerbsi for your kind words on the great progress we have made on our powerful africanamerican agenda for one lowest unemployment numbers in usa history many other great records foxandfriends foxnews,5
176,2020-02-16,Donald J. Trump, big progress  ,5
177,2020-02-16,Donald J. Trump, remember will be at daytona 500 tomorrow,5
178,2020-02-16,Donald J. Trump, years ago the democrats had the money to build the wall but they didn t have any idea how to get it done i am building it bigger and better than ever thought possible  ,5
179,2020-02-16,Donald J. Trump, thank you david  ,5
180,2020-02-15,Donald J. Trump, ig report on andrew mccabe misled investigators over roll in news media disclosure lacked candor lied on four separate occasions authotized media leaks to advance personal interests ig recommended mccabe s firing foxnews ingrahamangle,5
181,2020-02-15,Donald J. Trump, biggest test of his presidency emboldened ready to claim exoneration and take his case of grievance persecution and resentment to the campaign trail peter baker nytimes the greatest witch hunt in american history,5
182,2020-02-15,Donald J. Trump, ralph waldo emerson seemed to foresee the lesson of the senate impeachment trial of president trump when you strike at the king emerson famously said you must kill him mr trump s foes struck at him but did not take him down a triumphant mrtrump emerges from the,5
183,2020-02-15,Donald J. Trump, make america great again and then keep america great  ,5
184,2020-02-15,Donald J. Trump, nice  ,5
185,2020-02-15,Donald J. Trump, great honor i think mark zuckerberg recently stated that donald j trump is number 1 on facebook number 2 is prime minister modi of india actually i am going to india in two weeks looking forward to it,5
186,2020-02-15,Donald J. Trump, louiegohmerttx1 is a fantastic republican from the great state of texas he fully supports our maga and kag agenda border wall military vets and your second amendment louie is my friend and has my complete and total endorsement http  ,5
187,2020-02-15,Donald J. Trump, i look forward to attending the daytona 500 on sunday with lots of my great friends from florida including the france family and repmichaelwaltz from fl6 see you there good luck to everyone nascar senrickscott marcorubio govrondesantis  ,5
188,2020-02-15,Donald J. Trump, thank you arnold very nice  ,5
189,2020-02-15,Donald J. Trump, today flotus and i encourage all americans to cherish and honor the memory of those we have lost through acts of love and service we will hold parkland forever in our hearts,5
190,2020-02-15,Donald J. Trump, it has been two years since the tragedy in parkland we will always mourn the innocent lives taken from us 14 wonderful students and 3 terrific educators earlier this week i met with families whose experiences from that horrible day still pierce the soul,5
191,2020-02-15,Donald J. Trump, tommcclintock is a strong conservative leader who will always fight for the people of california he fully supports our maga agenda will continue to secure our border loves our military vets is strong on the 2a tom has my complete endorsement http  ,5
192,2020-02-15,Donald J. Trump, jodeyarrington from the great state of texas has been an incredible supporter of our maga agenda jodey fully supports securing our border w the wall he loves our military vets and is strong on the 2a jodey has my complete and total endorsement  ,5
193,2020-02-15,Donald J. Trump, mointhehouse brooks is running for congress in the great state of alabama he is a huge supporter of the maga agenda mo fully supports securing our border wthe wall he loves our military vets is strong on the 2a mo has my complete endorsement  ,5
194,2020-02-14,Donald J. Trump, the greatest name in politics patrick mchenrycampaign from the great state of north carolina is a conservative fighter and a true leader who always supports our maga agenda patrick has my complete and total endorsement  ,5
195,2020-02-14,Donald J. Trump, thank you to the beautiful country of cambodia for accepting the carnivalcruise ship westerdam into your port the united states will remember your courtesy mickyarison,5
196,2020-02-14,Donald J. Trump, it is happening again to crazy bernie just like last time only far more obvious they are taking the democrat nomination away from him and there s very little he can do a rigged system,5
197,2020-02-14,Donald J. Trump, 95 approval rating in the republican party thank you,5
198,2020-02-14,Donald J. Trump, always continue every republican senator except romney many highly religious people all very smart voted against the impeachment hoax sencapito was all in a great person i was told by many that manchin was just a puppet for schumer pelosi that s what he is,5
199,2020-02-14,Donald J. Trump, i was very surprised disappointed that senator joe manchin of west virginia voted against me on the democrat s totally partisan impeachment hoax no president has done more for the great people of west virginia than me pensions and that will,5
200,2020-02-14,Donald J. Trump, president trump with smart policies has done more to help the black community than any president in the modern era ingrahamangle foxnews,5
201,2020-02-14,Donald J. Trump, the president has never asked me to do anything in a criminal case ag barr this doesn t mean that i do not have as president the legal right to do so i do but i have so far chosen not to,5
202,2020-02-13,Donald J. Trump, i m seeing governor cuomo today at the white house he must understand that national security far exceeds politics new york must stop all of its unnecessary lawsuits harrassment start cleaning itself up and lowering taxes build relationships but don t bring fredo,5
203,2020-02-13,Donald J. Trump, which he actually has a military and legal obligation to do his incredible wife karen who i have a lot of respect for once pulled me aside said strongly that john respects you greatly when we are no longer here he will only speak well of you wrong,5
204,2020-02-13,Donald J. Trump, when i terminated john kelly which i couldn t do fast enough he knew full well that he was way over his head being chief of staff just wasn t for him he came in with a bang went out with a whimper but like so many x s he misses the action just can t keep his mouth shut,5
205,2020-02-13,Donald J. Trump, drain the swamp we want bad people out of our government,5
206,2020-02-13,Donald J. Trump, mini mike is a 5 4 mass of dead energy who does not want to be on the debate stage with these professional politicians no boxes please he hates crazy bernie and will with enough money possibly stop him bernie s people will go nuts,5
207,2020-02-13,Donald J. Trump, mini mike bloomberg is a loser who has money but can t debate and has zero presence you will see he reminds me of a tiny version of jeb low energy bush but jeb has more political skill and has treated the black community much better than mini  ,5
208,2020-02-13,Donald J. Trump, deven nunes predicts that more examples of mueller team misconduct will be revealed in coming weeks seanhannity foxnews,5
209,2020-02-13,Donald J. Trump, now it looks like the fore person in the jury in the roger stone case had significant bias add that to everything else and this is not looking good for the justice department foxandfriends foxnews,5
210,2020-02-13,Donald J. Trump, great news kag2020  ,5
211,2020-02-12,Donald J. Trump, claudiatenney is a fantastic candidate running in new york where she was a great member of congress she is strong on crime borders cutting taxes your 2a and she loves our military and vets claudia has my complete and total endorsement  ,5
212,2020-02-12,Donald J. Trump, nmalliotakis is running for congress in ny i know her well we need her to defeat max rose who voted for impeachment nicole is strong on crime borders 2a cutting taxes she loves our military vets nicole has my complete total endorsement  ,5
213,2020-02-12,Donald J. Trump, mattformontana rosendale is a strong conservative fighter for montana matt stands w our brave veterans loves our military and he will continue working to secure our border matt will never let our 2a go unprotected matt has my total endorsement http  ,5
214,2020-02-12,Donald J. Trump, wesleyhunttx is running for congress in the great state of texas he will help us accomplish our america first policies wesley is strong on crime the border our 2nd amendment trade military and vets wesley has my complete and total endorsement  ,5
215,2020-02-12,Donald J. Trump, augustpfluger is a great veteran and strong leader for texas where he is running for congress he will protect your 2a fight for our farmers oilgas workers and he supports our maga kag agenda august has my complete and total endorsement  ,5
216,2020-02-12,Donald J. Trump, bethvanduyne did great things as mayor of irving texas with my administration she is a strong conservative who supports border security loves our military vets and supports your 2a beth has my full endorsement for congress  ,5
217,2020-02-12,Donald J. Trump, jayobernolte of california is running for congress in 2020 jay will help me to continue securing the southern border he loves our great law enforcement officers military vets and he will protect your 2a jay has my complete and total endorsement  ,5
218,2020-02-12,Donald J. Trump, ending surprise medical billing moving ahead in congress thanks to ways means and educationlabor committees for your work on bills to protect patients and end medical bill ripoffs work with energy commerce help committees to send bipartisan bill to my desk,5
219,2020-02-12,Donald J. Trump, if my hands were tied iran would have a field day sends a very bad signal the democrats are only doing this as an attempt to embarrass the republican party don t let it happen,5
220,2020-02-12,Donald J. Trump, it is very important for our country s security that the united states senate not vote for the iran war powers resolution we are doing very well with iran and this is not the time to show weakness americans overwhelmingly support our attack on terrorist soleimani,5
221,2020-02-12,Donald J. Trump,  ,5
222,2020-02-12,Donald J. Trump, dagenmcdowell every democrat is running to raise taxes she pocahontas lied about her ethnicity that was her problem mariabartiromo so true dagen,5
223,2020-02-12,Donald J. Trump, two months in jail for a swamp creature yet 9 years recommended for roger stone who was not even working for the trump campaign gee that sounds very fair rogue prosecutors maybe the swamp foxandfriends tuckercarlson,5
224,2020-02-12,Donald J. Trump, congratulations to attorney general bill barr for taking charge of a case that was totally out of control and perhaps should not have even been brought evidence now clearly shows that the mueller scam was improperly brought tainted even bob mueller lied to congress,5
225,2020-02-12,Donald J. Trump, fake news cnn and msdnc have not surprisingly refused to talk about my record setting number of voters in new hampshire and in iowa that s why they are poorly rated fake news i will win both states in november,5
226,2020-02-12,Donald J. Trump, the fake news media is looking hard for the big democrat story but there is nothing too fabulous wouldn t a big story be that i got more new hampshire primary votes than any incumbent president in either party in the history of that great state not an insignificant fact,5
227,2020-02-12,Donald J. Trump, thank you brad  ,5
228,2020-02-12,Donald J. Trump, prosecutorial misconduct  ,5
229,2020-02-12,Donald J. Trump, bootedgeedge buttigieg is doing pretty well tonight giving crazy bernie a run for his money very interesting,5
230,2020-02-12,Donald J. Trump, a very bad night for mini mike,5
231,2020-02-12,Donald J. Trump, a lot of democrat dropouts tonight very low political iq  ,5
232,2020-02-12,Donald J. Trump, who are the four prosecutors mueller people who cut and ran after being exposed for recommending a ridiculous 9 year prison sentence to a man that got caught up in an investigation that was illegal the mueller scam and shouldn t ever even have started 13 angry democrats,5
233,2020-02-12,Donald J. Trump, impeachment king steyer how did that work out spent 200 million dollars and got less than 1 of the vote in iowa and only 3 of the vote in new hampshire could it be that something is just plain missing not easy to do what i did is it,5
234,2020-02-12,Donald J. Trump, elizabeth warren sometimes referred to as pocahontas is having a really bad night i think she is sending signals that she wants out calling for unity is her way of getting there going home and having a nice cold beer with her husband,5
235,2020-02-12,Donald J. Trump, whatever happened to hillary campaign manager podesta s brother wasn t he caught forced to leave his firm with big bad things to happen why did nothing ever happen to him only to the other side,5
236,2020-02-12,Donald J. Trump, and a swamp creature with pull was just sentenced to two months in jail for a similar thing that they want stone to serve 9 years for a phony mueller witch hunt disgrace caught  ,5
237,2020-02-12,Donald J. Trump, is this the judge that put paul manafort in solitary confinement something that not even mobster al capone had to endure how did she treat crooked hillary clinton just asking  ,5
238,2020-02-12,Donald J. Trump, all starting to unravel with the ridiculous 9 year sentence recommendation  ,5
239,2020-02-11,Donald J. Trump, when jerome powell started his testimony today the dow was up 125 heading higher as he spoke it drifted steadily downward as usual and is now at 15 germany other countries get paid to borrow money we are more prime but fed rate is too high dollar tough on exports,5
240,2020-02-11,Donald J. Trump, new stock market record congratulations spend your money wisely keep america great,5
241,2020-02-11,Donald J. Trump, great being in new hampshire last night i would say that was the biggest political rally in new hampshire history incredible evening,5
242,2020-02-11,Donald J. Trump, best usa economy in history,5
243,2020-02-11,Donald J. Trump, this is a horrible and very unfair situation the real crimes were on the other side as nothing happens to them can not allow this miscarriage of justice  ,5
244,2020-02-11,Donald J. Trump, just returned to white house from dover very sad  ,5
245,2020-02-11,Donald J. Trump, nice conflict brown dropped out of presidential race fast polled at zero  ,5
246,2020-02-11,Donald J. Trump, disgraceful  ,5
247,2020-02-11,Donald J. Trump, should never happen to another president  ,5
248,2020-02-11,Donald J. Trump, tough guys for trump  ,5
249,2020-02-11,Donald J. Trump, thank you new hampshire   t3s,5
250,2020-02-10,Donald J. Trump, a lot of people feel defeated trump always wins it seems like nothing can stop him danny villazon nytimes danaperino foxnews but isn t that what you want from your president,5
251,2020-02-10,Donald J. Trump, wall street journal editorial she crazy nancy aimed at trump and hit uncle joe,5
252,2020-02-10,Donald J. Trump, meeting with us governors in a short while all states are doing well thank you mr president,5
253,2020-02-10,Donald J. Trump, thank you to mirandadevine of the new york post for your interesting and correct column today trump has gained 20 points since impeachment began in october he gets 67 on economy nonwhite approval of trump is also at a high 28 up 10 points in a year nice one nancy,5
254,2020-02-10,Donald J. Trump, hope the fake news which never discusses it is talking about the big crowds forming for my new hampshire rally tonight they won t,5
255,2020-02-10,Donald J. Trump, because of how badly they did with the impeachment hoax aoc will primary cryin chuck schumer and win and jerry nadler has a good chance of losing to his far left primary opponent it is all getting quite interesting pelosi will lose the house again my poll numbers great,5
256,2020-02-10,Donald J. Trump, 95 approval rating in the republican party a record 53 overall plus add 9 points corrupt democrat politicians have brought me to highest polling numbers ever with the impeachment hoax thank you nancy,5
257,2020-02-10,Donald J. Trump, will be in manchester new hampshire tonight for a big rally want to shake up the dems a little bit they have a really boring deal going on still waiting for the iowa results votes were fried big crowds in manchester,5
258,2020-02-09,Donald J. Trump, make america great again and then keep america great,5
259,2020-02-09,Donald J. Trump, drain the swamp,5
260,2020-02-09,Donald J. Trump, this is the biggest political crime in american history by far simply put the party in power illegally spied on my campaign both before and after the election in order to change or nullify the results of the election it continued on with the impeachment hoax terrible,5
261,2020-02-09,Donald J. Trump, fbi director christopher wray just admitted that the fisa warrants and survailence of my campaign were illegal so was the fake dossier therefore the whole scam investigation the mueller report and everything else for three years was a fixed hoax who pays the price,5
262,2020-02-09,Donald J. Trump, so good to see that republicans will be winning the great state of alabama senate seat back now that lightweight senator dougjones cast a partisan vote for the impeachment hoax thought his boss cryin chuck would have forced him to vote against the hoax a do nothing stiff,5
263,2020-02-09,Donald J. Trump, larrysabato is much better at giving you the answer after everything is finished and the final result is in than he is at telling you what is going to happen because in fact he doesn t have a clue  ,5
264,2020-02-09,Donald J. Trump, sabato got it all wrong last time never came close to understanding the trump voter actually it s simple make america great again and then keep america great  ,5
265,2020-02-09,Donald J. Trump, it s all turning and fast mvp heckler  ,5
266,2020-02-09,Donald J. Trump, they conservatives thought the merits of the impeachment case were weak and therefore his romney s judgement is questioned mzhemingway howardkurtz foxnews,5
267,2020-02-09,Donald J. Trump, they are really mad at senator joe munchkin in west virginia he couldn t understand the transcripts romney could but didn t want to,5
268,2020-02-09,Donald J. Trump, romney hurt some very good republican senators and he was wrong about the impeachment hoax no clue  ,5
269,2020-02-09,Donald J. Trump, yes  ,5
270,2020-02-09,Donald J. Trump, this is so true  ,5
271,2020-02-09,Donald J. Trump, this will never get old  ,5
272,2020-02-09,Donald J. Trump, deface the nation will tell lindseygrahamsc that he must start up judiciary and not stop until the job is done clean up dc now last chance  ,5
273,2020-02-09,Donald J. Trump, i grew up in new york city and over many years got to watch how great nyc s finest are now because of weak leadership at governor mayor stand away water thrown at them regulations and lack of support our wonderful nyc police are under assault stop this now,5
274,2020-02-09,Donald J. Trump, the dems are crazed they will do anything honesty truth don t matter to them they are badly wounded iowa vote count was a disaster for them  ,5
275,2020-02-09,Donald J. Trump, leading also in new hampshire and most states the fake news hates to report this but you will see on november 3rd  ,5
276,2020-02-09,Donald J. Trump, the feeling of many about mittromney  ,5
277,2020-02-09,Donald J. Trump, thank you to everyone for all of the great reviews i have gotten on my state of the union speech it was an immense honor for me to have presented it to you and the citizens of our very strong and wonderful country,5
278,2020-02-09,Donald J. Trump, but just like the people of west virginia will no longer look at weak pathetic joe manchin the same i got the pension bill approved manchin couldn t do it the wonderful people of utah will never look at grandstander mitt romney with anything but contempt disgust,5
279,2020-02-09,Donald J. Trump, can t say i mind the fact that the great people of west virginia are furious at their puppet democrat senator joe manchin they will never forget his phony vote on the impeachment hoax all he had to do is read the transcripts sadly which he wouldn t understand anyway,5
280,2020-02-09,Donald J. Trump, law enforcement has been notified be careful tough guys who you play with  ,5
281,2020-02-09,Donald J. Trump, great lineup on foxnews tonight with jessebwatters judgejeanine and greggutfeld all starts at 800 pm will be discussing and explaining the impeachment hoax,5
282,2020-02-09,Donald J. Trump, a great coach and a fantastic guy his endorsement of me in indiana was a very big deal  ,5
283,2020-02-08,Donald J. Trump, pete rose played major league baseball for 24 seasons from 19631986 and had more hits 4256 than any other player by a wide margin he gambled but only on his own team winning and paid a decades long price get pete rose into the baseball hall of fame it s time,5
284,2020-02-08,Donald J. Trump, total and complete endorsement for debbie lesko repdlesko love arizona  ,5
