,Date,name,tweet,death
285,2020-02-08,Donald J. Trump, governor cuomo wanted to see me this weekend he just canceled very hard to work with new york so stupid all they do is sue me all the time  ,5
286,2020-02-08,Donald J. Trump, we will not be touching your social security or medicare in fiscal 2021 budget only the democrats will destroy them by destroying our country s greatest ever economy,5
287,2020-02-08,Donald J. Trump, the worst weeks ever she could have had a much better week if crazy nancy who is the most overrated person in politics going to lose the house a second time didn t bring the phony corrupt impeachment hoax dems can t do anything right just look at the iowa vote count,5
288,2020-02-08,Donald J. Trump, repdebdingell who called me tears flowing to thank me for rolling out the maximum red carpet for the funeral of her husband then voted against me on the partisan impeachmen hoax said everybody dems wants to get out of town this has been in my whole career one of,5
289,2020-02-08,Donald J. Trump, the only way to stop the crazed radical left do nothing democrats is for the republican senate to run an offense here leesmithdc ingrahamangle foxnews so true although the dems hoaxes witch hunts have driven up republican polls and mine mightily,5
290,2020-02-08,Donald J. Trump, crazy nancy pelosi s impeachment hoax has lifted republican congressional polls she lost the house once before and my polls way up which was expected but it has had a great effect on republican senate races including north carolina kentucky colorado and arizona thanks,5
291,2020-02-08,Donald J. Trump, thank you iowa for the record vote we just received in the primary the dems were 25 down although their votes are all fried  ,5
292,2020-02-08,Donald J. Trump, was given a horrendous report by his superior the man he reported to who publicly stated that vindman had problems with judgement adhering to the chain of command and leaking information in other words out,5
293,2020-02-08,Donald J. Trump, fake news cnn msdnc keep talking about lt col vindman as though i should think only how wonderful he was actually i don t know him never spoke to him or met him i don t believe but he was very insubordinate reported contents of my perfect calls incorrectly,5
294,2020-02-08,Donald J. Trump, not good  ,5
295,2020-02-08,Donald J. Trump,  ,5
296,2020-02-08,Donald J. Trump, after years building up other countries we are finally rebuilding our country from our inner cities to our rural communities the forgotten men and women of america are forgotten no longer opportunitynow  ,5
297,2020-02-07,Donald J. Trump, always continue every republican senator except romney many highly religious people all very smart voted against the impeachment hoax sencapito was all in a great person i was told by many that manchin was just a puppet for schumer pelosi that s all he is,5
298,2020-02-07,Donald J. Trump, i was very surprised disappointed that senator joe manchin of west virginia voted against me on the democrat s totally partisan impeachment hoax no president has done more for the great people of west virginia than me pensions and that will,5
299,2020-02-07,Donald J. Trump, great to be in charlotte north carolina as we expand and grow this unprecedented economic momentum today we launched a brand new nationwide campaign to revitalize underserved cities and towns across america it s called opportunity now   t3s,5
300,2020-02-07,Donald J. Trump, another win just in nervous nancy pelosi and the democrats in congress sued me thrown out this one unanimous in the dc circuit witch hunt,5
301,2020-02-07,Donald J. Trump, jobs jobs jobs promisesmadepromiseskept  ,5
302,2020-02-07,Donald J. Trump, iowa and new hampshire will not be moved from the primary schedule as long as i am president great tradition,5
303,2020-02-07,Donald J. Trump, off to north carolina  ,5
304,2020-02-07,Donald J. Trump, the democrat party has given up on counting votes in iowa looks like it all got computer fried nobody knows who the real winner is maybe it s sleepy joe but it s not looking that way they lost millions millions of dollars all for nothing but i won iowa big,5
305,2020-02-07,Donald J. Trump,  ,5
306,2020-02-07,Donald J. Trump, i think they should blame russia russia russia again if they can t count votes properly how are they going to run us healthcare  ,5
307,2020-02-07,Donald J. Trump, welcome back james  ,5
308,2020-02-07,Donald J. Trump, very true thank you ted john i love texas  ,5
309,2020-02-07,Donald J. Trump, so do i  ,5
310,2020-02-07,Donald J. Trump, thank you charlie  ,5
311,2020-02-07,Donald J. Trump, don t worry it won t happen  ,5
312,2020-02-07,Donald J. Trump, he will be successful especially as the weather starts to warm the virus hopefully becomes weaker and then gone great discipline is taking place in china as president xi strongly leads what will be a very successful operation we are working closely with china to help,5
313,2020-02-07,Donald J. Trump, just had a long and very good conversation by phone with president xi of china he is strong sharp and powerfully focused on leading the counterattack on the coronavirus he feels they are doing very well even building hospitals in a matter of only days nothing is easy but,5
314,2020-02-07,Donald J. Trump, the senate acquitted president trump of both charges fabricated by congressional democrats led by speaker pelosi and adam schiff to carry out the most egregious and partisan attack against any president in our history a man they knew to be innocent loudobbs foxbusiness,5
315,2020-02-07,Donald J. Trump, this president has done more for african americans in this country than any president since lincoln loudobbs,5
316,2020-02-07,Donald J. Trump,  ,5
317,2020-02-07,Donald J. Trump, welcome back to earth astro_christina and congratulations on breaking the female record for the longest stay in space you re inspiring young women and making the usa proud enjoyed speaking with you and astro_jessica on the first allfemale spacewalk in history last year,5
318,2020-02-07,Donald J. Trump, nevada i hear you on yucca mountain and my administration will respect you congress and previous administrations have long failed to find lasting solutions my administration is committed to exploring innovative approaches i m confident we can get it done,5
319,2020-02-06,Donald J. Trump, so true  ,5
320,2020-02-06,Donald J. Trump,   t7s,5
321,2020-02-06,Donald J. Trump, had failed presidential candidate mittromney devoted the same energy and anger to defeating a faltering barack obama as he sanctimoniously does to me he could have won the election read the transcripts,5
322,2020-02-06,Donald J. Trump, nytimes the votes were a resounding victory for mr trump true but the impeachment hoax was just a continuation of the radical left do nothing democrats corrupt practices,5
323,2020-02-06,Donald J. Trump,  ,5
324,2020-02-06,Donald J. Trump, i will be making a public statement tomorrow at 1200pm from the whitehouse to discuss our country s victory on the impeachment hoax,5
325,2020-02-05,Donald J. Trump,  ,5
326,2020-02-05,Donald J. Trump,  ,5
327,2020-02-05,Donald J. Trump, the democrats want to run a country and they can t run a caucus brad blakeman foxnews iowa is a complete disaster for the dems they should bring in mini mike bloomberg asap,5
328,2020-02-05,Donald J. Trump, thank you jonathan and great job  ,5
329,2020-02-05,Donald J. Trump, it was a great and triumphant evening for our country thank you for all of the nice remarks and wonderful reviews of my state of the union speech it was my great honor to have done it,5
330,2020-02-05,Donald J. Trump, sotu2020  ,5
331,2020-02-05,Donald J. Trump,  ,5
332,2020-02-04,Donald J. Trump, my approval rating in the republican party 95 a record big iowa win approval rating overall 53 a new high with our great economy and other major successes would be 20 points higher without the phony witch hunts and hoaxes,5
333,2020-02-04,Donald J. Trump, market up big today on very good economic news jobs jobs jobs,5
334,2020-02-04,Donald J. Trump, the democrat party in iowa really messed up but the republican party did not i had the largest reelection vote in the history of that great state by far beating president obama s previous record by a lot also 97 plus of the vote thank you iowa,5
335,2020-02-04,Donald J. Trump, when will the democrats start blaming russia russia russia instead of their own incompetence for the voting disaster that just happened in the great state of iowa,5
336,2020-02-04,Donald J. Trump, it is not the fault of iowa it is the do nothing democrats fault as long as i am president iowa will stay where it is important tradition  ,5
337,2020-02-04,Donald J. Trump, the democrat caucus is an unmitigated disaster nothing works just like they ran the country remember the 5 billion dollar obamacare website that should have cost 2 of that the only person that can claim a very big victory in iowa last night is trump,5
338,2020-02-04,Donald J. Trump, big win for us in iowa tonight thank you,5
339,2020-02-04,Donald J. Trump, many people do not know what a great guy fantastic political talent the great rush limbaugh is there is nobody like him looking for a speedy recovery for our friend  ,5
340,2020-02-03,Donald J. Trump,  ,5
341,2020-02-03,Donald J. Trump, where s the whistleblower where s the second whistleblower where s the informer why did corrupt politician schiff make up my conversation with the ukrainian president why didn t the house do its job and sooo much more,5
342,2020-02-03,Donald J. Trump, keep america great,5
343,2020-02-03,Donald J. Trump, make america great again,5
344,2020-02-03,Donald J. Trump, republicans in iowa go out and caucus today your great trade deals with china mexico canada japan south korea and more are done great times are coming after waiting for decades for our farmers ranchers manufacturers and all nobody else could have pulled this off,5
345,2020-02-03,Donald J. Trump, i hope republicans the american people realize that the totally partisan impeachment hoax is exacty that a hoax read the transcripts listen to what the president foreign minister of ukraine said no pressure nothing will ever satisfy the do nothing radical left dems,5
346,2020-02-03,Donald J. Trump, lindseygrahamsc  ,5
347,2020-02-03,Donald J. Trump, the dnc on bernie sanders looks like they re going to do it to him again doesn t it stevedoocy foxandfriends,5
348,2020-02-03,Donald J. Trump, hope you liked this  ,5
349,2020-02-03,Donald J. Trump, great company  ,5
350,2020-02-03,Donald J. Trump, thank you mike  ,5
351,2020-02-03,Donald J. Trump, so great  ,5
352,2020-02-03,Donald J. Trump, congratulations to the kansas city chiefs on a great game and a fantastic comeback under immense pressure we are proud of you and the great state of missouri you are true champions,5
353,2020-02-03,Donald J. Trump, i promised to restore hope in america that includes the least among us together let s keep america great text trump to 88022 if you liked our super bowl ad  ,5
354,2020-02-03,Donald J. Trump, enjoy the game usa our country is doing great,5
355,2020-02-02,Donald J. Trump, my superbowl interview at 330 pm on foxnetworks enjoy,5
356,2020-02-02,Donald J. Trump, mini mike is now negotiating both to get on the democrat primary debate stage and to have the right to stand on boxes or a lift during the debates this is sometimes done but really not fair,5
357,2020-02-02,Donald J. Trump, many of the ads you are watching were paid for by mini mike bloomberg he is going nowhere just wasting his money but he is getting the dnc to rig the election against crazy bernie something they wouldn t do for corybooker and others they are doing it to bernie again 2016,5
358,2020-02-02,Donald J. Trump, mini mike is part of the fake news they are all working together in fact bloomberg isn t covering himself too boring to do or other dems only trump that sounds fair it s all the fake news media and that s why nobody believes in them any more,5
359,2020-02-02,Donald J. Trump, the radical left do nothing democrats don t want justice when pushing the impeachment hoax they only want to destabilize the republican party so they can do better in the 2020 election that includes the house senate they are playing with the people by taking it this far,5
360,2020-02-02,Donald J. Trump, correct  ,5
361,2020-02-02,Donald J. Trump, thanks for your invaluable help chuck  ,5
362,2020-02-02,Donald J. Trump, wall is moving along strong tall and quickly thank you jim for all of your help  ,5
363,2020-02-02,Donald J. Trump, thank you john  ,5
364,2020-02-02,Donald J. Trump, happy birthday to a wonderful man friend  ,5
365,2020-02-01,Donald J. Trump, getting a little exercise this morning  ,5
366,2020-02-01,Donald J. Trump, trump poll numbers are the highest since election despite constant phony witch hunts tens of thousands of people attending rallies which the fake news never mentions to see the greatest show on earth fun because usa is winning again  ,5
367,2020-02-01,Donald J. Trump, congratulations to loudobbs number one lou has shown the fake news what happens when you cover america s greatest president fairly objectively maga kag  ,5
368,2020-02-01,Donald J. Trump, no matter what you give to the democrats in the end they will never be satisfied in the house they gave us nothing,5
369,2020-02-01,Donald J. Trump, democrats 17 witnesses republicans 0 witnesses,5
